{
  "defaults": {
    "lang": "es",
    "theme": "dark",
    "view": "resumen"
  },
  "meta": {
    "title": "",
    "description": ""
  },
  "runtimeConfig": {
    "contactEmail": "",
    "reserveSubject": "",
    "workshopSubject": "",
    "links": {
      "footerContact": "",
      "reserveMailto": "",
      "reserveCalendar": "",
      "reserveNotebook": "",
      "workshopCalendar": "",
      "workshopMailto": ""
    },
    "pricing": {
      "bootcamp": {
        "current": "",
        "regular": "",
        "currency": ""
      },
      "assistantUnit": "",
      "empowerment": {
        "current": "",
        "regular": "",
        "currency": ""
      },
      "workshopBonus": "",
      "roiPrice": "",
      "automationFactor": ""
    }
  },
  "i18n": {
    "es": {},
    "en": {}
  },
  "i18nHtml": {
    "es": {},
    "en": {}
  },
  "infoData": {},
  "modulesData": [],
  "assistantNames": [],
  "textBySelector": {},
  "htmlBySelector": {},
  "attributesBySelector": {}
}
